{
  "schema_version": "3.0",
  "completion_version": "1.0",
  "completion_id": "completion-002",
  "task_id": "task-001",
  "session_id": "session-001",
  "result_id": "result-001",
  "decision_id": "decision-001",
  "snapshot_id": "snapshot-001",
  "raw_candidate": "00A-17/9",
  "displayed_candidate": "00A-17/9",
  "final_serial": "00A-17/8",
  "completion_source": "user_corrected",
  "threshold_version": "auto-exact-pet-v1",
  "threshold_classification": "PET",
  "auto_threshold_strictly_greater_than": 0.8,
  "whole_string_exact_probability_calibrated": 0.83,
  "gate_outcomes": {
    "support": true,
    "localization": true,
    "quality": true,
    "ocr_integrity": true,
    "freshness": true,
    "format_policy": true,
    "deterministic_safety": true,
    "no_unknown_blocking": true,
    "version_compatibility": true
  },
  "policy_version": "policy-id",
  "calibration_version": "cal-id",
  "model_version": "model-id",
  "preprocess_version": "prep-id",
  "schema_version_used": "3.0",
  "idempotency_key": "completion-key-002",
  "idempotency_fingerprint": "sha256:completion-002",
  "created_at": "2026-07-31T10:00:02Z",
  "supersedes_completion_id": "completion-001"
}
